{
  "$schema": "https://nativeui.qzz.io/schema.json",
  "typescript": true,
  "outputDir": "src/components/ui",
  "expoRunner": "pnpm",
  "baseDependencies": [
    "react-native-reanimated",
    "react-native-worklets",
    "@rn-primitives/portal"
  ],
  "components": [
    "accordion",
    "alert",
    "alert-dialog",
    "aspect-ratio",
    "avatar",
    "badge",
    "button",
    "button-group",
    "calendar",
    "card",
    "carousel",
    "checkbox",
    "date-picker",
    "dialog",
    "empty",
    "field",
    "input",
    "input-otp",
    "label",
    "lib-theme",
    "lib-use-styles",
    "progress",
    "radio-group",
    "select",
    "separator",
    "skeleton",
    "sonner",
    "spinner",
    "switch",
    "table",
    "textarea",
    "typography"
  ]
}
